{
  "schema_version": 1,
  "enabled": false,
  "limits": {
    "brief_max_chars": 40000,
    "report_max_bytes": 400000,
    "chars_per_token": 3.5,
    "context_growth_reserve_tokens": 4000,
    "startup_max_chars": 12000
  },
  "harnesses": [
    {
      "id": "cline-cli",
      "adapter": "cline",
      "command": "cline",
      "argv": [
        "--data-dir",
        "{rundir}/harness-state",
        "--cwd",
        "{rundir}",
        "--provider",
        "{provider}",
        "--model",
        "{model}",
        "--thinking",
        "medium",
        "--auto-approve",
        "true",
        "--json",
        "Read all of {brief}: complete its startup section, then do exactly what its contract requires inside {workspace}, run its validation, and write your report to {report}."
      ],
      "description": "Cline CLI as a bounded worker. Flags confirmed against Cline CLI 3.86.2: --data-dir gives the run its own isolated state so no global Cline configuration is touched, and the worker writes the report itself because the CLI has no output-file flag. Re-confirm the flags against your installed version; this adapter never runs the command. Its system prompt and tool definitions consume context before the brief is read: about 6805 tokens were observed on this build, declared conservatively as 7000. Re-measure it for your version; an understated overhead lets a dispatch be prepared that the worker cannot accept.",
      "context_overhead_tokens": 7000
    },
    {
      "id": "replacement-harness",
      "adapter": "command",
      "command": "example-replacement-harness",
      "argv": [
        "--brief",
        "{brief}",
        "--report",
        "{report}",
        "--workspace",
        "{workspace}"
      ],
      "description": "Illustrates that any harness accepting a brief and writing a report can replace Cline without changing packets or contracts. Its overhead is declared 0 only because this illustration adds no prompt of its own; a real harness must declare what it actually consumes.",
      "context_overhead_tokens": 0
    }
  ],
  "bindings": [
    {
      "resource_id": "lmstudio-synthetic-t0",
      "harness_id": "cline-cli",
      "provider": "lmstudio",
      "model": "example-local-coder-model-replace-me",
      "api_base": "http://127.0.0.1:1234/v1",
      "credential_env": null,
      "served_context_window": 8192
    },
    {
      "resource_id": "lmstudio-synthetic-t1",
      "harness_id": "cline-cli",
      "provider": "lmstudio",
      "model": "example-local-general-model-replace-me",
      "api_base": "http://127.0.0.1:1234/v1",
      "credential_env": null,
      "served_context_window": 16384
    },
    {
      "resource_id": "mistral-synthetic-t2",
      "harness_id": "cline-cli",
      "provider": "mistral",
      "model": "example-mistral-model-replace-me",
      "api_base": null,
      "credential_env": "EXAMPLE_MISTRAL_API_KEY",
      "served_context_window": null
    }
  ]
}
